COUNTRY|Updated on|Response
Australia|2020-04-02|"The Public Health Laboratory Network (PHLN), a standing committee of the Australian Health Protection Principal Committee (AHPPC), is Australia’s leading network of expert microbiologists. This group is comprised of public health laboratory representatives from each state and territory of Australia. They meet weekly to provide advice, share information and support other laboratories, such as hospital, community and private pathology providers, when issues arise. So far, the Australian Government has funded or will fund the following R&D initiatives in response to the COVID-19 pandemic:

- $15 million to fast-track research into treatments from the Medical Research Future Fund (MRFF) (https://www.health.gov.au/ministers/the-hon-greg-hunt-mp/media/fast-tracking-research-into-treatments-for-covid-19) via three open competitive grant opportunities: 
o $8 million to identify and develop antiviral therapies for people infected with COVID-19 ($3 million will initially be provided to test up to 10 antiviral therapies to test proof of concept; a further $5 million then available for rapid advancement of the most promising candidates).
o $5 million for clinical trials to better treat and manage COVID-19 patients with severe acute respiratory distress. 
o $2 million to support research into development of a vaccine to protect against novel coronavirus (COVID-19).

- More than $2.6 million in cutting-edge diagnostics research at the Peter Doherty Institute for Infection and Immunity. (https://www.health.gov.au/ministers/the-hon-greg-hunt-mp/media/26-million-for-coronavirus-research-including-a-new-simpler-australian-pathology-test)

On 22 March 2020, a funding injection of up to $17 million (https://stories.uq.edu.au/news/2020/17m-shot-in-the-arm-for-uq-covid-19-vaccine-research/index.html) was announced for vital University of Queensland research that could help cut the timeline for an effective vaccine for COVID-19 by six months:
• the Queensland Government will allocate $10 million
• the Australian Government has pledged $3 million to the project led by UQ’s School of Chemistry and Molecular Biosciences. 
• the Paul Ramsay Foundation has provided a grant of $3.5 million to the University of Queensland, conditional upon the University of Queensland securing another $6.5 million to reach a total of $20 million from government and other sources.

The Australian Government will invest $30 million for COVID–19 research to enable Australian researchers to contribute to global efforts to control the outbreak. Three research areas, in line with the priorities agreed at the recent Coronavirus Research Roundtable, are vaccine development, anti-viral development and respiratory medicine research

The Therapeutic Goods Administration (TGA) is fast tracking (i.e. accelerating) regulatory assessment for applications for a therapeutic good related to COVID-19. In some cases, for example point of care tests, due to limited information at the time of application, regulatory approval is granted, with strict conditions that follow-up data and studies including stability shelf-life is provided to the TGA.  In addition, a number of exemptions for complying with normal regulatory processes and approvals are in place to facilitate faster access and supply for some tests and PPE medical devices. 
• Therapeutic Goods (Medical Devices—Accredited Pathology Laboratories) (COVID-19 Emergency) Exemption 2020 (F2020N00032);(https://www.legislation.gov.au/Details/F2020N00032/Download)  and
• Therapeutic Goods (Medical Devices—Face Masks and Other Articles) (COVID-19 Emergency) Exemption 2020 (F2020N00033).(https://www.legislation.gov.au/Details/F2020N00033/Download) 

See: https://www.tga.gov.au/legal-supply-covid-19-diagnostic-tests

The National Health and Medical Research Council (NHMRC) funds a Centre of Research Excellence dedicated to emergency pandemic response – the Australian Partnership for Preparedness Research on Infectious Disease Emergencies (APPRISE). Funding for this network is AUD$5 million over 5 years from 2016 to 2021 (see: https://www.apprise.org.au/). APPRISE is supporting 16 urgent research projects covering areas such as diagnostics, treatment and communication in response to COVID-19. It is joining forces with the NHMRC Centre of Research Excellence in Emerging Infectious Diseases (CREID), to support the national collaborative projects designed to fill areas of critical research need and improve Australia’s emergency response to COVID-19. 
"
Austria|2020-04-03|"A dedicated Joint Call for COVID-19 with a volume of € 21 Mio. from the two Austrian Federal Ministries,the Ministry of Digitalisation and Economy together with the Ministry for Climate Action, Environment, Mobility, Innovation and Technology  was launched in March to support applied research on tests, vaccines and medication against COVID-19 Mio. See https://www.ffg.at/ausschreibung/emergencycall-covid-19. The Federal Ministry of Education, Science and Research is supporting its Medical Universities to participate in medical trials with an extra € 2 Mio.

The Austrian Science Fund (FWF) has introduced fast track approval for COVID-19 relevant research.

The Austrian authorities treat all applications for medical trials preferentially in order to grant approval as fast as possible.

Additionally,  Austrian research groups successfully participate in the special Horizon 2020 call at the European level.
"
Belgium|2020-05-13|"Flanders regional measures: https://stiplab.github.io/Covid19/files/innovation_in_flanders_to_combat_the_sars-cov-2_virus_or_its_derived_effects_-_11_may_2020.pdf
Wallonia regional measures: http://stiplab.github.io/Covid19/files/2020-05-08_COVID-19_-_Cadastre_RI_COVID19_EN.pdf

In the last two weeks, we have seen in Belgium numerous initiatives to respond to the Covid-19 crisis. However, these are mainly bottom-up. Everywhere around the country, research groups in all universities and in research centres, as well as in companies, have reallocated budgets to address different issues. 

One example is the case of the Vlaams Instituut voor Biotechnologie (VIB) that announced the reallocation of about 1 million Euro of its budgets for its Grand Challenges Programme to COVID-19 projects.

In the region of Wallonia, the BioWin cluster (active in the field of health biotechnology and medical technologies) has developed an interactive platform for centralization of health initiatives related to COVID-19 around 6 urgent themes: manufacturing, supply and recycling of masks for companies; development and repair of ventilators; development and manufacturing of hydroalcoholic gels; development and manufacturing of new diagnostic approaches; development of new treatments; and new sources of funding  (https://www.biowin.org/en/news/covid-19-join-biowins-cooperation-platform).

Another example is the case of ITM (Institute of Tropical Medicine) experts who joined colleagues of the Catholic University of Leuven (KU Leuven) to set up an epidemiological database. 

Also the Young Academy (an interdisciplinary and inter-university group of top young researchers and artists in Flanders) launched a number of initiatives to join forces among scientists from all disciplines, including coordination on the production of ventilation equipment and the collection of initiatives in a Slack-environment for scientists.
"
Brazil|2020-04-03|"The Ministry of Science, Technology, Innovation and Communications of Brazil (MCTIC) established an advisory committee and strategic plan to provide coordinated and quick responses to emerging viruses. This ""Virus-MCTIC Network"" coordinates the efforts of research laboratories with a view to identifying complementarities of infrastructure and activities in the ongoing research on Covid-19, influenza and others. The objectives of the network are the integration of scientific research and development efforts in the area of emerging viruses; definition of research priorities; coordination of ongoing R,D&I initiatives related to emerging viruses; and development of technologies to assist the country in facing those challenges. Researchers and representatives of MCTIC, the Ministry of Health and development agencies participate in the initiative.  

As an example, within this network, the National Center for Research in Energy and Materials (CNPEM) is already employing tools like computational biology and AI to evaluate the effectiveness of about 2 thousand existing drugs against Covid-19. Computational data tests use atomic structure data and the behavior of Covid-19 proteins to examine the interaction of molecules of available medications with these target proteins, and to pre-select those that show promise in interfering with the infection. Selected molecules will then be tested in vitro to verify its effectiveness in eliminating the virus, which will allow the new use of already available medications. 

The emergency release of R$ 3.4 billion (around USD 700 million) to be used in initiatives to fight the pandemic has recently been approved by the Federal government. The funds will be allocated to the Ministry of Science, Technology, Innovation and Communications; Ministry of Foreign Affairs; Ministry of Defense; and Ministry of Citizenship.From that amount, R$ 100 million (around USD 20 million) will be directed to STI measures, from the National Scientific and Technological Development Fund (FNDCT), to be applied in Research Networks, National Institutes of Science and Technology (INCT) and public calls via the Brazilian National Council for Scientific and Technological Development (CNPq) and the Funding for Studies and Projects Agency (Finep) 

The funds will be used for emergency support of projects (grants) within the scope of the priorities defined by the Virus-MCTIC Network, including: - Development of diagnostic kits; - Development of vaccines; - Use of advanced technologies for rapid selection of possible drugs; - Large-scale sequencing and monitoring of mutations in SARS-Cov 2 (COVID-19) samples; - Structuring a virus sample bank for scientific studies to understand the disease. 

The State National Postal Service Company (Correios) is acting as the logistics partner for the Virus-MCTIC Network, being responsible for collecting viral material (new coronavirus and influenza) from selected laboratories and delivering them to other labs (in-kind contribution). These are being used in studies on contagion, proliferation of viruses and vaccines for diseases. Scientists working on the matter now have priority in receiving and sending research material, since time is crucial for the effectiveness of research with COVID-19. 

A research call for projects has already been launched on the total of R$ 50 million (around USD 10 million) by CNPq. The call is aimed at projects on diagnosis, vaccines, clinical trials and other research related to the virus. Overall priority is given to the development of a) medications and respective pre-clinical and clinical tests; b) vaccines and respective pre-clinical and clinical tests; c) innovation for the production in large scale of ventilators and personal protective equipment (PPE) and their related systems; Research, development and innovation in diagnostic tests are also a priority; monitoring and sequencing the virus genome circulating in the country; telemedicine tools.  

The Ministry of Health has authorized the use of telemedicine to care for patients with coronavirus (March 23rd, 2020). To this end, the MCTIC will carry out: I - direct contracting of projects, studies, technologies and innovations; II - public call (s) for contracting projects, studies, technologies and innovations; and III - coordination between organizations in the science, technology, innovation and communications system. 

MCTIC has also launched 7 orders for technology acquisition on the total amount of R$ 50 million (around USD 10 million). They include development of products for genetic sequencing, clinical trials protocol, the application of AI on inhibiting virus replication, development of test kits and vaccines as well as social projects. 

Another initiative by MCTIC is the launch of the platform IdearuMCTIC (www.mctic.gov.br), aimed at connecting ideas and evaluating the maturity of technological solutions related to the challenges imposed by the pandemic. 

Besides that, funding State agencies such as FAPESP (State of São Paulo), Fundação Araucária (State of Paraná) and FAPERJ (State of Rio de Janeiro), as well as funding federal agencies such as CAPES (Ministry of Education), are releasing funds for research on tackling the challenges caused by the pandemic, such as the development of tests or vaccines, as well as the genomic sequencing of the virus. Other entities like EMBRAPII (Brazilian Industrial Research and Innovation Company), SEBRAE (Brazilian Micro and Small Business Support Agency), and Porto Digital (Science park located at the State of Pernambuco) are taking efforts for innovative solutions to be developed, such as the fabrication of ventilators and of tests for diagnosis of COVID-19. 

The São Paulo Research Foundation (FAPESP) launched a call for research proposals on COVID-19 within the time limit of 24 months, with a view to understanding the virus` epidemiological characteristics, developing tests and therapies, conducting research on clinical procedures, identifying and evaluating innate immune responses and issues related to the social behavior of the affected population. The total amount of the research call is R$ 10 million (around USD 2 million). 

FAPESP and FINEP, under the PIPE/PAPPE Grant Program, launched a call for research projects on the development of technologies for products, services and processes to fight Covid-19. The research call will allow that participants from previous phases of the Grant program (Phase 1 or Phase 2) to commercialize emergency products or services.  

Brazilian Micro and Small Business Support Agency (SEBRAE) will assign R$ 2 million (around USD 400 thousand) to the development of technological solutions by startups and other small and medium-sized enterprises with a view to help the Brazil face Covid-19. The funds will add up to R$ 4 million (around USD 800 thousand) from the Brazilian Industrial Research and Innovation Company (EMBRAPII) and contributions by participating companies and accredited research and innovation centers. Joint resources are expected to reach the total of R$ 10 million (around USD 2 million). The resources may be used for software development, system devices, hardware, medical parts and equipment, and others. 

EMBRAPII has also approved R$ 2.3 million (USD 900 thousand) to the development of mechanical ventilators, that provides oxygen and removes carbon dioxide directly from the blood.  

The National Service for Industrial Training (SENAI), through the ""Innovation Call for Industry"", will select projects that help prevent, diagnose and treat Covid-19. It foresees the destination of R$ 10 million (around USD 2 million) for proposals on solutions against problems caused by the virus, with immediate application and results within 40 days, in the areas of consulting, metrology, testing, analysis, research, development and innovation. Examples of these solutions are the manufacture of mechanical respirators and the development of rapid tests for the detection the disease. 

The National Council of State Foundations of Research Support (CONFAP) released a proposal for Brazilian institutions to join the so-called ""Development of therapy and diagnosis for fighting coronavirus infections"" launched by `Innovative Medicines Initiative`, in cooperation with European Union and the European Federation of Pharmaceutical Industries and Associations (EFPIA). Its objective is to identify new therapeutic agents, early diagnostic systems, and reliable data related to Covid-19. Brazilian partners can participate in a co-financing scheme. The European side plans to disburse EUR 45 million. 

The University of São Paulo (USP) is conducting researches for vaccine development with a quick response against the virus. The work takes advantage of results from previous studies on other types of coronaviruses, which, hopefully, can help in the case of Covid-19. Brazilian research is comparatively safer, as it is based on the creation of a particle similar to coronavirus, the VLP (virus-like particle), equivalent to a hollow virus, without the genetic material and therefore without the transmissibility of the disease.  

The Covid Challenge 19 is an initiative by the Public Persecutor`s Office of the State of Pernambuco (MPPE), the State Health Secretariat of Pernambuco (SES-PE) and Porto Digital. The MPPE and SES-PE offer R$ 1.3 million for innovative and high-impact solutions that can be adopted in a short term, with a view to fighting the virus. The challenge already includes the submission of 543 ideas on 5 areas: a) monitoring the risk groups; b) information flow management; c) monitoring social isolation; d) support for health agents; and e) testing and diagnosis. 
"
