COUNTRY|Updated on|Response
Canada|2020-05-08|"A report on Government of Canada's research response to COVID-19 was released on April 23, 2020, which outlines a number of the initiatives below. https://www.canada.ca/en/public-health/services/publications/diseases-conditions/covid-19-government-canada-research-response.html

Rapid Research Response to COVID-19: On February 10, 2020, the Government of Canada launched a Rapid Research Funding Opportunity. 
o Result:  99 research projects ($54.2M over 2 years) funded to provide new evidence on how to address COVID-19 in two broad research areas:
1.Medical countermeasures research (e.g., transmission and zoonotic source of the 2019-nCov, development and evaluation of diagnostic tools for early case detection and surveillance, and development and evaluation of candidate vaccines, among other areas) and 
2.Social and policy countermeasures research (e.g., examining how individuals and communities understand and react to the disease, and developing strategies to combat misinformation, stigma, and fear).

On March 11, 2020, the Government of Canada announced more than $1 billion for a whole-of-government COVID-19 Response Fund which included $100 million to support federal public health measures such as enhanced surveillance, increased testing at the Public Health Authority of Canada's (PHAC) National Microbiology Laboratory (NML) and ongoing support for preparedness in First Nations and Inuit communities.

On March 20, Canada launched its plan to ‘Mobilize Industry’ to fight COVID-19. https://pm.gc.ca/en/news/news-releases/2020/03/20/prime-minister-announces-canadas-plan-mobilize-industry-fight-covid. The plan introduced new measures directly supporting businesses to build domestic capacity, find innovative solutions, and speed procurement of essential supplies. It refocuses Canada’s existing industrial and innovation programs (i.e. Strategic Innovation Fund, Innovation Superclusters and Innovative Solutions Canada) by adding to their mandate a requirement that they prioritize the fight against COVID-19. It also directed support to key Canadian companies that are working on large-scale, late-stage R&D projects aiming, in the immediate term, at producing countermeasures to COVID-19. The National Research Council’s Industrial Research Assistance Program also launched a COVID-19 ‘challenge’ program to address a range of medium-term governmental needs, the most promising of which will be selected for procurement, working with Innovative Solutions Canada. https://nrc.canada.ca/en/research-development/research-collaboration/nrc-covid-19-programs

On March 23, 2020, $275 million was announced as part of the $1 billion investment (from March 11) to support research and large-scale efforts towards countermeasures to combat COVID-19. The funding is facilitating partnerships among various Canadian stakeholders including other government departments, industry and academia to respond to COVID-19 and build Canadian capacity to produce a domestic supply of potential vaccines and treatments. https://pm.gc.ca/en/news/news-releases/2020/03/23/canadas-plan-mobilize-science-fight-covid-19. Funding will be used to advance projects already underway by university researchers and others, including: prioritizing projects under the new Strategic Innovation Fund COVID-19 stream ($192M) for companies including: AbCellera in Vancouver and Medicago in Quebec City. The Government also committed to invest $23M in the University of Saskatchewan’s Vaccine and Infectious Disease Organization - International Vaccine Centre (VIDO-InterVac) ($11M from CFI, $12M from WD) to strengthen research expertise, help develop a vaccine, and expand clinical trials and bio-manufacturing capacity in the facility. The National Research Council will receive $15M to upgrade its Human Health Therapeutics facility in Montreal to develop, test and scale up promising vaccine candidates.  The Government will also support BlueDot, a Toronto-based technology firm, and use its disease analytics platform to support modelling and monitoring of the spread of COVID-19, and to inform government decision-making as the situation evolves.

On March 31, 2020, the Natural Sciences and Engineering Research Council announced it is providing up to $15 million, as part of its Alliance COVID-19 Grants Initiative, to support academic researchers to contribute their expertise and their research results to address challenges and questions raised by the public and not-for-profit sectors, as well as industry in the context of the pandemic. https://www.nserc-crsng.gc.ca/Innovate-Innover/COVID-19/index_eng.asp

In late March, Canada became a participant in ""SOLIDARITY”, the WHO-led international clinical trial to help find an effective treatment for COVID-19. By enrolling patients in multiple countries, the SOLIDARITY trial aims to rapidly discover whether any of the drugs slow disease progression or improve survival. WHO has secured access to all treatments so as to obviate the supply issues that may be associated with other trials. The Canadian arm of the global trial, dubbed CATCO (Canadian Treatments for COVID-19), is being funded by the CIHR, which provided nearly $1 million. https://www.canada.ca/en/health-canada/services/drugs-health-products/covid19-clinical-trials/list-authorized-trials.html https://www.who.int/emergencies/diseases/novel-coronavirus-2019/global-research-on-novel-coronavirus-2019-ncov/solidarity-clinical-trial-for-covid-19-treatments

On April 23, 2020 the Government of Canada announced further investments of $1.1B in new medical countermeasures to better understand COVID-19, and develop the infrastructure needed to fight the virus here in Canada. This includes:
o The establishment of the COVID-19 Immunity Task Force that will establish priorities and oversee the coordination of a series of country-wide blood test surveys that will tell us how widely the virus has spread in Canada and provide reliable estimates of potential immunity and vulnerabilities in Canadian populations.
o $40 million for the Canadian COVID-19 Genomics Network (CanCOGeN), led by Genome Canada, to coordinate a COVID-19 viral and host genome sequencing effort across Canada. This research will help track the virus, its different strains, and how it makes people sick in different ways, providing valuable information to public health authorities and decision-makers as they put in place measures to control the pandemic. The results of this work will be available to researchers globally to support additional research, including Canadian vaccine development efforts.
o $23 million for the Vaccine and Infectious Disease Organization-International Vaccine Centre (VIDO-InterVac) to accelerate development of a vaccine against COVID-19. This funding will support pre-clinical testing and clinical trials of a potential COVID-19 vaccine, essential steps to ensuring that vaccines are effective and safe for human use. 
o $29 million for the National Research Council of Canada to begin the second phase of critical upgrades to its Human Health Therapeutics facility in Montréal. Building on ongoing work to ready the facility for the production of vaccines for clinical trials, this funding will support operations to maintain the facility, as well as provide infrastructure to prepare vials for individual doses as soon as a vaccine becomes available.
o $600 million, through the Strategic Innovation Fund, over two years to support COVID-19 vaccine and therapy clinical trials led by the private sector, and Canadian biomanufacturing opportunities.
o $10 million for a Canadian data monitoring initiative so we can coordinate and share pandemic-related data across the country to enhance Canada’s response to COVID-19.
o $10.3 million over two years, and $5 million ongoing, to support the Canadian Immunization Research Network in conducting vaccine-related research and clinical trials, and to enhance Canada’s capacity to monitor vaccine safety and effectiveness.
o $114.9 million through the Canadian Institutes of Health Research for research projects that will accelerate the development, testing, and implementation of medical and social countermeasures to mitigate the rapid spread of COVID-19, as well as its social and health impacts.
o Separately, the Government of Canada is providing over $675,000 through the Stem Cell Network to support two new research projects and one clinical trial. The clinical trial will evaluate the safety of a potential cell therapy to reduce the impacts and severity of acute respiratory distress associated with COVID-19, and the two projects will generate critical information about how cells in the airway and brain are affected by the virus.
https://pm.gc.ca/en/news/news-releases/2020/04/23/prime-minister-announces-new-support-covid-19-medical-research-and
"
Chile|2020-04-22|"The Ministry of Science, Technology, Knowledge e Innovation together with CORFO and the support of the Government Laboratory, launched two calls of Covid-19 Innovation Challenges. 
The first one is focused on generating rapid implementation solutions for the local demand of personal health protection elements related to possible contagion by droplets and personal contact (mask, gloves, health clothing, etc). This call will bring a CL$90 million (US$104.000) grant per project in two stages, during 6 months.
https://www.corfo.cl/sites/cpp/convocatorias/retos_de_innovacion_elementos_de_proteccion_covid19 

The second one calls entrepreneurs, companies, universities and technology centers to register their developments in diagnostic technologies for COVID19 as well as other viral pathogens that affect human health. These technologies could cover the entire chain from sampling, extraction supplies, reagents, others, to diagnosis and its results. This registration does not involve financing.
https://www.corfo.cl/sites/cpp/convocatorias/retos_de_innovacion_covid19 
"
Colombia|2020-03-28|"● Mapping molecular biology laboratories in Colombian Universities:

The Ministry of Science, Technology and Innovation is leading the initiative for mapping molecular biology laboratories in Colombian universities through a survey designed by the academic sector. This instrument was a task requested by the Ministry of Science, Technology and Innovation, the Ministry of National Education and the National Institute of Health of Colombia, with the objective of mapping the capacities of the laboratories in the universities of Colombia to support the molecular diagnosis of COVID-19 from the identification of the genetic markers for SARS-CoV-2.

This information will be an essential input to know which laboratories have BCL-2 biosafety standards and have documented and verified procedures for quality assurance, sample traceability and validity of results. Furthermore, the results of the survey will detect if these laboratories have methodological control and endorsement of the tests and service qualification. It is important to clarify that the survey is still in the process of completion by the universities and other entities, therefore the results are not conclusive yet.

● Program: Strengthening and provision of equipment, infrastructure and medical supplies for early detection and care of patients affected by Coronavirus in Colombia ""Covid-19 Colombia""

This project aims to increase the conditions of care for laboratories in frontier areas and vulnerable territories in the departments of Amazonas, Cauca, Chocó, Guajira, Magdalena, Nariño, San Andrés and Vichada in the context of the campaign against COVID-19. The total budget for the project is 19,5 million dollars, with the Ministry of Science, Technology and Innovation of Colombia contributing 6,5 million dollars and seeking to leverage 13 million dollars. This project arises from the profound imbalance existing between regions in Colombia, where social gaps highlight the need to improve public health equipment and capacities in the border areas and other areas with high levels of vulnerability.

This objective will be achieved by strengthening the provision of equipment, infrastructure and medical supplies to laboratories and research centers for the early detection and care of patients possibly affected by COVID-19. The following 3 results are expected:

i) Provision of equipment for laboratories and medical staff for the testing of COVID-19.
ii) To design a strategy for the Social Appropriation and Dissemination of Knowledge about COVID-19.
iii) Support for research centers, universities and companies in R&D and innovation projects against COVID-19.

"
Costa Rica|2020-05-05|"The government has opened a call for non-refundable funds to offer training, technical assistance and specialized support to SMEs in the areas of electronic commerce, innovation management, digital transformation, operational excellence and productive transformation towards the bioeconomy, with the aim of helping SMEs to optimize, reorient or complement their productive activities, so that they have better tools to cope with and overcome the economic situation owing to the COVID-19 emergency. 

Also, the Ministry of Science, Technology and Communications has enabled 791 million colones to finance actions in innovation, science and technology in order to fight COVID-19. The first call opened on April 16 and is part of the Innovation and Human Capital for Competitiveness Program (PINN), with the support of the Inter-American Development Bank (IDB). These funds apply for innovation and technology transfer projects to support the health emergency, with an investment of up to ₵712 million. The maximum amount to be awarded per project will be ₵142,000,000 and the maximum execution period will be 12 months.

Meanwhile, the Incentive Fund will open on May 15 a call for up to ₵79 million to support research on issues related to COVID-19.

The Clodomiro Picado Institute obtained financing of ₵35 million from CONICIT to start the development of a possible treatment against COVID-19.

The Biotechnology Nacional Research Center (CENIBIOT in Spanish) is working on the development of a low cost Covid-19 detection protocol, based on PCR (polymer chain reaction), in conjunction with the University of Costa Rica, the Technological Institute of Costa Rica and Inciensa Research Center. 

Further information on the call can be found at the link: https://micit.go.cr/12-proyectos-innovacion-y-transferencia-tecnologia-concurso-1-2-1-20-2
"
Czech Republic|2020-05-18|"The Czech Science Foundation (hereinafter referred to as „GACR“) is the only institution in the Czech Republic that provides public funding exclusively for basic research projects (https://gacr.cz/en/). GACR also supports bilateral cooperation with foreign agencies on the Lead Agency principle approach. 
• GACR is engaged in the Austrian joint call ""Urgent Funding SARS-CoV-2"" announced by the Austrian Science Foundation (FWF), https://gacr.cz/vyhlaseni-vyzvy-urgent-funding-sars-cov-2/. The GACR’s budgetary allocation for the call is approximately 3 million EUR.
• GACR is also engaged in the Swiss SNSF Covid-19 international call (https://gacr.cz/vyhlasujeme-vyzvu-nrp-78-covid-19/) with the 1.5 million EUR approximate allocation.

The Technology Agency of the Czech Republic (hereinafter referred to as „TACR“) supports applied research, experimental development and innovation (https://www.tacr.cz/en/). TACR permits to its running projects to enlarge their scope and ask for additional financial support for activities related to COVID-19 (i.e. top-up funding), https://www.tacr.cz/aktivity-na-podporu-vavai-covid-19/. New calls focused on addressing the Covid-19 topics have been launched by TACR too with the following budgetary allocations:
• Approx. 3.7 million EUR for the projects financed under the “GAMA” programme.
• Approx. 3.7 million EUR for the projects financed under the “ETA” programme.
• Approx. 3.7 million EUR for the projects financed under the “TREND” programme. 
(The recent currency rate used above is 27 CZK / EUR.)

The Ministry of Education, Youth and Sports of the Czech Republic (hereinafter referred to as “MEYS”) financially supports the large research infrastructures (https://www.vyzkumne-infrastruktury.cz/en/). The Czech Republic is a Member State of numerous international research infrastructures and is engaged in the efforts that the research community is developing in response to the Covid-19 pandemic.  An overview of related activities in response to the Covid-19 epidemic can be fund at https://www.vyzkumne-infrastruktury.cz/en/2020/04/czechia-as-a-member-of-international-research-infrastructures-in-response-to-sars-cov-2-covid-19/.

The Ministry of Industry and Trade of the Czech Republic (hereinafter referred to as „MIT“) has announced several initiatives for projects to support fight against the coronavirus epidemic:
• MIT calls for projects through its program „The Country for the Future“. The contest is thematically focused on the introduction of new solutions through innovation process in small and medium-sized enterprises. The amount of the subsidy can reach up to 25 million CZK/project (approx. 1 million EUR).  In total approx. 11.1 million EUR have been allocated for the projects to be financed under the “Country for the Future” programme. (https://www.mpo.cz/cz/podnikani/podpora-vyzkumu-a-vyvoje/novy-program-na-podporu-inovaci-the-country-for-the-future--246526/)
• MIT announced XII. COVID-19 Call under the Technology Program within the implementation of Operational Programme Entrepreneurship and Innovations for Competitiveness (hereinafter referred to as „OP EIC“). The call is aimed at supporting business activities focusing on manufacturing of medical devices and personal protection or disposal of infectious waste and those with the fight against the further spread of coronavirus infection through the acquisition of new technological equipment. The allocation is set at approx. 11.1 million EUR. (https://www.mpo.cz/cz/podnikani/dotace-a-podpora-podnikani/oppik-2014-2020/vyzvy-op-pik-2020/vyzva-xii--covid-19-programu-podpory-technologie--253993/)
• The MIT has been a long-term support provider for development of state-of-the-art technologies and innovations and has announced a call for applications under the „Czech Rise Up – Smart measures against the COVID-19“OP EIC sub-program. Projects will undergo the Czech version of the hackathon “Hack the Crisis – Czech Rise Up”. It is organized by the CzechInvest agency jointly with the MIT and in cooperation with Poland and Estonia. Approx. 7.4 million EUR is set for the projects to be supported. (https://www.mpo.cz/cz/podnikani/dotace-a-podpora-podnikani/program-czech-rise-up/program-czech-rise-up---chytra-opatreni-proti-covid19--253805/; https://www.mpo.cz/en/) 
• MIT also announced a call „Innovation vouchers COVID-19“ under the OP EIC to promote sharing of knowledge and know-how between businesses and research community, which entrepreneurs can use exclusively for the fight against coronavirus infection. MIT is ready to allocate approx. 2 million EUR. (https://www.mpo.cz/cz/podnikani/dotace-a-podpora-podnikani/oppik-2014-2020/vyzvy-op-pik-2020/vyzva-v--covid-19-programu-podpory-inovacni-vouchery--254025/)

Another iniciative taken by the MIT related to COVID-19 is described under the Q4A. 
"
Denmark|2020-03-28|"The Danish government has funded research projects, which can help to create new knowledge and new solutions in the fight against Covid-19. In total DKK 50 million has been granted in a fast track model, where the deans of the four faculties of health sciences, the pro-rector of the Technical University of Denmark (DTU) and the academic director of the Statens Serum Institute (SSI) have been asked to submit proposals for Covid-19 related research projects from the researchers at their own institutions.
The whole process took about one week, from call for proposals, to relevant research projects being identified, and funding granted. 
"
Estonia|2020-03-30|"The Estonian Research Council (ETAg) is coordinating collection of information about the need for new research topics and the capabilities of research performing organizations to do the needed research. 

The quickest way to react is to channel researchers' immediate responses within the framework of existing measures. The planned interventions are divided into short-term fast-line research that provide an up-to-date understanding of the spread of the virus, as well as to help identify the immediate socio-economic effects. This type of research is expected to bring results within a few months. Longer-term research grants are currently being developed – these are more forward looking and will require a longer-term effort.  

Short-term needs are addressed in the framework of the RITA program (see https://www.etag.ee/en/funding/programmes/rita/) through which ETAg has launched an additional call for projects addressing COVID-19. At least two projects (worth approximately 50 000 euros each) will be co-financed (ministries will contribute with 40% of co-financing). Topics will be selected and approved by the scientific advisers of different ministries. The call is open to all R&D institutions. The dedication of more additional funding from structural funds is currently under negotiations with the Ministry of Education and Research.
  
Some of the research groups are working with their international counterparts within existing cooperation networks. 


"
