COUNTRY|Updated on|Response
Peru|2020-05-22|"In March 29th,  The National Council of Science, Technology and Technological Innovation, through its National Fund for Science,Technology and Technological Innovation, launched a public call for research initiatives named “Special projects: Responding to COVID-19”. The call intends to create new scientific knowledge, development, innovation and adaptation of technologies, products, mechanisms or new or improved services which could provide fast solutions to the challenges created by the pandemic. 

For this call, we prioritized 5 themes:
Development, adaption and/or validation of detection systems (diagnosis).
Telehealth, mobile health and digital epidemiological vigilance systems. 
Technological and innovation systems
Treatment  (medicines, vaccines)
Epidemiological and social studies.

Given the need of prompt responses to the crisis, we will prioritize projects in an advanced stage of development, high impact innovation concepts and short term response potential in the following areas:

Projects of applied research
Projects of technological development
Projects of technological adaptation.

We have received 600 concept notes, 55% of which were submitted by universities, 29% came from companies, 6% from research or innovation institutions and the remaining proposals were submitted by public and private institutions which host research units.

In regards to themes covered by the proposals, 14% corresponds to the development and/or validation of rapid tests used for COVID-19 diagnosis. Another 14% of the proposals were related to the treatment of the virus. 29% of the concept notes corresponds to technological and innovation developments, where medical artifacts such artificial ventilation machines required by intensive care units are required. 27% of the proposals present new developments in telehealth and mobile health, and also digital information systems or health management, while the remaining 16% proposals are related to epidemiological and social studies.

During the call for applications we received 600 concept notes, of which 29 were finally selected.We would like to highlight some of the initiatives which have qualified to received the funds, according to their respective priority areas.

Telehealth and Mobile Health 

Characterizing COVID-19: Data analysis tool for COVID-19 patients. 
Health information Digital System in Peru as a tool for decision making in the context of COVID-19 Pandemic. 
Technological development of a remote monitoring and diagnostics system geared towards patients in the rehabilitation stage after recovering from COVID-19 through the use of low-cost device relying on digital spirometry based on exhaled air.
Mobile app for population screening monitoring and screening in Loreto, one of the most heavily affected regions in the country. 
Brigadist collaboration network for researching, detecting, and primary management of severely affected COVID-19 communitary cases.

Treatment

Biological-computational platform for the analysis of new chemical entities, medicines and natural products with potential antiviral effect against SARS-CoV-2.
Production of an anti SARS-CoV-2 vaccine, based on the spike protein expressed in insect cells, and the the evaluation of their security and immunogenicity in animals and voluntary human beings.

Detection Systems

Rapid molecular diagnose tests for COVID-19.

Technological devices and innovation

Low-cost portable electronic device for evaluating the risk of developing pneumonia based on the abnormal lung sounds in suspected COVID-19 patients from vulnerable areas.
Low-cost Mechanical ventilators with minimum characteristics for COVID-19’s emergency.
High respiratory protection equipment universal platform, relying on 3D printing.
Vital sign monitoring device for COVID-19 cases and patients with other diseases.
Anti COVID-19 surgical respirator of the use of health personnel
Rectilinear point fabric reusable face masks able to protect the user against COVID-19. Adequate for health personnel and people exposed to infection on the grounds of their working conditions.
Epidemiological and social studies

Dynamic control of the COVID-19 Virus
Decentralized genomic surveillance system for assessing the transmission and evolution of SARS-CoV-2 in Peru.
COVID-19 systemic study in the health sector and its impact on the peruvian economy and the development of dynamic government policies at the regional level through the use of soft system dynamics and data science.


For supporting the development of the selected initiatives, an initial amount of 5 million soles will be granted. However,we intend to launch additional funds and launch more calls in the near future. In the following link you will find the details of the call https://www.fondecyt.gob.pe/convocatorias/innovacion-y-transferencia-tecnologica/proyectos-especiales-respuesta-al-covid-19 
"
Poland|2020-05-15|"                                                  1) The National Centre for Research and Development allocated 200 000 000 PLN to fight against coronavirus.
The Polish entrepreneurs and scientists who work on diagnostics, treatment and prevention of viral diseases obtained 200 000 000 PLN. The National Centre for Research and Development announced the Fast Track ""Coronavirus"" contest. A proven formula to finance innovation from the European Funds was used in order to fight against coronavirus pandemic.
The National Centre for Research and Development envisaged three basic thematic areas which should include projects submitted for co-financing. There are the following:
- diagnostics - devices for quickly detecting the coronavirus presence in the body;
- treatment - researches on the use of existing or new drugs as well as works on vaccines;
- prevention - preventive measures limiting the spread of the SARS-CoV-2 coronavirus and the activities to the Polish antivirus shield: improving biosecurity, protecting society  and supporting its functioning in epidemiological crisis situations.
Both SMEs and large companies as well as consortia consisting of entrepreneurs or entrepreneurs and scientific units can apply for support. The main condition of receiving the grant is the innovation of the proposed solution at least at the national level as well as the need to its implement on the market. The projects submitted for funding in the contest may include industrial researches, experimental development and pre-implementation works. Only experimental development works are treated as mandatory element. The minimum project value for single SME is 1 000 000 PLN and for large companies and consortia - 2 000 000 PLN. The maximum value of eligible costs of projects co-financed by the National Centre for Research and Development may not exceed 50 000 000 EUR.
                                           
                                           2) Express call to fund research on COVID-19 by the National Science Centre with a total budget of 10 mln PLN
https://www.ncn.gov.pl/ogloszenia/konkursy/covid-19?language=en

                                          3) Changes to the terms of the CEUS-UNISONO call for proposals related to the launch of the FWF Urgent Funding for Research Into 
                                              Humanitarian Crises like Epidemics and Pandemics with participation of the National Science Centre
https://ncn.gov.pl/aktualnosci/2020-04-08-zmiana-warunkow-konkursu-ceus-unisono?language=en

                                           4) Support for hospitals focusing on COVID-19 related patients by the National Centre for Research and Development with a total budget of 100 
                                               mln PLN 
The National Centre for Research and Development launched a new support for hospitals focusing on COVID-19 related patients on R&D activities. These hospitals can apply for funding projects preventing the spread of SARS-CoV-2 virus, protecting personnel and treating COVID-19.


5) Additional support for research (including on COVID-19) at the Małopolska Centre of Biotechnology - Jagiellonian University – one-off funding from the Ministry of Science and Higher Education of 25 000 000 PLN. Money for the Małopolska Centre of Biotechnology - Jagiellonian University should help in developing coronavirus vaccine.  


6) Production of the Polish coronavirus tests
The prototype of the Polish coronavirus test was developed by the researchers from the Institute of Bioorganic Chemistry of the Polish Academy of Sciences in Poznan. It will be possible to produce 100,000 pieces - based on the reagents of own production and the Polish companies. The National Centre for Research and Development allocated 100 000 000 PLN for this project.

7) IDUB against COVID-19 contest organized by the Warsaw University of Technology 
Financing activities on solutions dedicated to the COVID-19 pandemic and its effects is the main goal of this contest. Projects may concern both the area of basic researches and R&D works. The maximum project implementation period is 18 months and the project financing amount should not exceed 400 000 PLN. 


"
Portugal|2020-05-18|"Several initiatives have been taken in the current short timeframe of the emergence of COVID-19 crisis:
- An urgent research call for special projects has been launched to support innovative projects in response to the COVID-19 pandemia - Research 4 Covid-19 – by the Foundation for Science and Technology (FCT) – application between 24 March and 5 April. A second call is envisioned in one month's time, depending on progress of the pandemia. Both calls have a total funding of €1,5 million and are directed to short-term projects (3 month limit duration and funding per project limited to 30k€, focusing on complementing existing initiatives or reallocating existing human resources).
https://www.fct.pt/apoios/research4covid19/index.phtml.pt
- An additional research call has been launched, on March 27 with a deadline of May 28, in the context of the National Initiative for Digital Competences (INCoDe.2030) – AI 4 COVID-19 – Data Science and Artificial Intelligence in Public Administration to strengthen the fight to COVID-19 and future pandemias. These projects require the partnership of research institutes with public administration entities, and must be in line with the National Plan for the Preparation and Response to the Disease by the novel coronavirus (COVID-19) from the Directorate-General for Health (DGS). The projects are expected to focus on big data, analytic techniques and models, computational resources and products and results. The total funding available is € 3 million, with a maximum funding per project of € 240k and project duration between 24 and 36 months.
https://www.fct.pt/apoios/projectos/concursos/datascience/index.phtml.pt
- A Call for entrepreneurial ideas has been launched by the National Innovation Agency, ANI, which has already gathered a wide range of technological solutions which have been presented by research centres and innovative firms, on the areas of prevention/diagnostic, treatments, medical and hospital services, home support, business services, teaching/training, work organization and other objectives.
https://www.ani.pt/pt/portugal-inovador/portugal-inovador/solu%C3%A7%C3%B5es-covid-19/
- A platform to mobilize researchers - SCIENCE 4 COVID19 – to contribute to responses to the crisis is also being set up.
- As a result of the declaration of National State of Emergency, which imposed limitations on mobility and the requirement, when possible for the implementation of teleworking, and the closure of most public services and businesses except essential ones, MCTES determined the essential services in research and academic institutions to be maintained exempt of the limitations, namely those related to research and analysis on COVID-19, infrastructures requiring permanent maintenance, such as medical, veterinary and biological, those related to technological safety, ICT related infrastructural academic resources, social services for higher education students, and basic administrative services to guarantee regular flow of financial support.
- Existing resources to support distance learning and teleworking dedicated to the research and higher education system have been increased to respond to the sudden increase in demand, through FCT/FCCN. These include video platform COLIBRI, MOOC platform NAU, EDUCAST and VIDEOCAST.
- Legal procedures were put forward to guarantee that all academic evaluation requiring public exams (e.g. PhDs and Habilitation) can be held through the use of videoconferencing and electronic media.
- Research fellowships for degree award from FCT have been given a prorogation to account for the disturbances in the work progress due to the current crisis situation. Prorogation of deadlines in ongoing calls have also been implemented in order to support the significant changes brought about by the crisis, as well as the commitment by the health sciences researchers to the ongoing response. Elegibility of expenditure related to cancelled events due to the coronavirus emergency incurred in publicly funded projects has been changed and guaranteed.
"
Russian Federation|2020-04-01|"Since 13 March, 2020 the following policy measures related to STI are being implemented:

1. Allocation of additional budgetary funding (1.5 billion roubles) for the development of means of prevention and diagnosis of the new coronavirus infection (COVID-2019).
2. Allocation of additional budgetary funding for the domestic production of artificial respirating units (Source: https://xn--80aesfpebagmfblc0a.xn--p1ai/ai/html/3/attach/2020-03-26_coronavirus_government_report.pdf).
3. Since March 16, all Russian universities were recommended to introduce mixed and distance learning formats. To support universities during the transition period in connection with the unfavorable situation caused by the new coronavirus infection (COVID-2019), a Situation Center of the Russian Ministry of Education and Science and a hotline have been created. The recommendations for the universities on the transfer of educational courses to the online format were developed by the Ministry of Science and Higher Education.
4. The procedure for registration of medical devices for the diagnosis of coronavirus infection has been accelerated (https://www.rosminzdrav.ru/news/2020/03/26/13595-minzdrav-rossii-protsedura-registratsii-medizdeliy-dlya-diagnostiki-koronavirusnoy-infektsii-maksimalno-uskorena).
5. There is a possibility that national legislation regarding access to the market for new drugs can be revised in order to accelerate the implementation of the new drugs against the COVID-19.
6. On March 24 the Skolkovo Technopark initiated a crowdsourcing project to develop COVID-19 express medical tests available for wider population.
7. Skolkovo Foundation introduced a series of startup projects to the Government for direct support (see section B Q5)."
South Africa|2020-03-29|"• As a first step, the Department of Science and Innovation (DSI) has redirected R4 million (€219,000) from some of its projects to research on COVID-19. The Department is supporting local research that will focus on surveillance, therapeutics and understanding the local epidemiology and natural history of the virus. An additional R3 million has been  available from the International Cooperation and Resources (ICR) Funds within DSI for international cooperation.

• Secondly, the Department has availed R12 million for SA testing of drugs for Covid-19 treatment.

• The Technology Innovation Agency (TIA) is also considering to make funds available to fund some diagnostic and sequencing work.

• The DSI is also engaging with the Department of Health, the Medical Research Council, and the South African Health Products Regulatory Authority with a view to mobilising funding, reprioritising research strategies and creating an enabling ethical and regulatory framework to facilitate research on the COVID-19 virus.

• Strategies for the management of mild, moderate and severe COVID-19 infections will be considered and prioritised for further development, costing and implementation. The regulatory and ethics research agenda will include the review and approval of ethical and regulatory challenges pertaining to clinical research. The Department will also prioritise surveillance strategies with a view to funding the top priorities.

• Preliminary work on the development of vaccines has started with University of Cape Town (UCT), Council for Scientific and Industrial Research (CSIR) and Biovac. Also, the South African Centre for Epidemiological Modelling and Analysis (SACEMA) A is currently engaging with other sources of data and modelling groups, refining their assumptions with a view to produce an updated model of the spread of the epidemic over time. 
"
Spain|2020-04-01|"The Royal Decree-Law 8/2020, of 17 March, on extraordinary urgent measures to deal with the economic and social impact of the new corona virus COVID-19, has included the creation of new budget line of specific R&D funding with 30 million Euros for public research institutions. The Royal Decree Law has also included a dedicated CDTI budget line to provide up to 500 M€ in direct support to mid-caps and SMEs throughout partially reimbursable grants, with no need for any financial guarantee or collateral, seeking to facilitate access to capital for ongoing R&I projects or innovations needed to face the COVID 19 consequences. 

The Spanish research against COVID-19 is competitive and will bring results with the purpose to strengthen it in the research for the COVID-19 different measures has been put in Place:

• The Instituto de Salud Carlos III (ISCIII) which depends on the Ministry of Science and Innovation, has launched the COVID-19 call to finance research projects on the SARS-CoV-2 virus and the disease it causes, COVID-19. This call will have 24 million euros available, as approved by Royal Decree-Law 8/2020, of 17 March, on extraordinary urgent measures to deal with the economic and social impact of the new coronavirus. With this new resources, the ISCIII, as a health research funding body, will develop an urgent program of aid for projects and programs that aim to generate knowledge about the infection: to analyze and know the biology of the virus; to develop new therapeutic and prophylactic options, including vaccines; to develop an epidemiological surveillance system and to analyze its impact from the point of view of the health services.

Research areas
The initiatives presented, which may be based on projects already under development or be new initiatives, should focus on the following areas:

•  Development of techniques for rapid virological diagnosis of COVID-19, transferable to the industrial field and applicable to health care, with a priority focus on the diagnosis of early stages of infection and the management of severe cases to optimize stratification and health care.
• Clinical, biological and molecular characterization of the disease, with analysis of clinical stages, prognostic stratification and possible complications.
•  Development of innovative therapies, new antiviral, antiseptic and disinfectant molecules against SARS-CoV-2; studies of antiviral resistance and the effectiveness of non-pharmacological, prophylactic and therapeutic interventions.
• Characterization of SARS-CoV-2, knowledge of genetic and antigenic variation of the virus and management of the immune response and virus-host interaction.
• Development of vaccines, analysis of their efficacy and applicability
• Epidemiological surveillance and molecular study of COVID-19, with analysis of the incidence of mortality, morbidity and lethality; study of environmental and social factors of the spread, risk factors and population dynamics of the infection.
• Use of artificial intelligence tools and massive analysis of integrated data oriented to the epidemiological control of the COVID-19.
• Socio-economic impact of the disease: use of primary care resources, general hospital resources and critical care resources.

Research projects must respect the fundamental principles established in the current wording of the Declaration of Helsinki, promulgated by the World Medical Association, in the Council of Europe Convention on Human Rights and Biomedicine, in the UNESCO Universal Declaration on the Human Genome and Human Rights, as well as comply with the requirements established in Spanish legislation in the field of biomedical research, personal data protection and bioethics.

In addition, the National Biotechnology Centre (CNB) of the Spanish National Research Council (CSIC) will receive 4.45 million € for coronavirus research. CSIC is going to promote the development of its current research and advance in protection strategies against SARS-CoV2. CNB is a worldwide pioneer in a method for cloning viruses that allows them to be genetically manipulated to attenuate their virulence and achieve a vaccine. The team led by professors Luis Enjuanes and Isabel Sola is already working on a project to study the mechanisms of pathogenesis of the new coronavirus. 

The CNB project has six objectives: to generate basic tools and experimental models for the development of protection strategies; identification and testing of antiviral compounds for the treatment of SARS-CoV2; development of specific monoclonal antibodies for protection against the infection; development of the next generation of vaccine candidates; molecular, structural and functional characterization, and computer modeling to understand the spread of the new coronavirus.

The ISCIII, the CNB and other research centers have been declared critical health infrastructures and therefore remain fully operational for COVID-19 research.

In the domain of “clinical trials” related with the COVID19 the Spanish Agency for Drugs and Health Products (Agencia Española de Medicamentos y Productos Sanitarios (AEMPS) has authorized two new clinical trials with a new molecule (remdesivir) for patients with severe respiratory disease. The Ministry of Health is also involved in clinical trials with WHO with drugs related to HVI. All relevant information is available at https://www.aemps.gob.es/la-aemps/ultima-informacion-de-la-aemps-acerca-del-covid%E2%80%9119/.
 
---Innovation---

MICIN throughout CDTI – Centre for the Development of Industrial Technology- has been launching extraordinary measures to contribute to the fight against COVID19 and to support business R&I activities and capacities to prevent the slowdown of innovation in Spain, protect business R&I employment and maintain the competitiveness of the Spanish economy through innovation. Actions are part of current CDTI programs, and special attention will be paid to those proposals that may contribute to COVID19 health emergency. The measures adopted include:
1. Exemption from guarantees (from March 14, 2020) requested in partially reimbursable grants for R&I projects of SMEs and midcaps ranging from 0,5-1,0  Million EUROS for SMEs, to 3 Million EUROS for midcaps. For R&I projects related to products considered emergency by the Government in relation to COVID-19, the exemption of guarantees will be doubled. This measure will mobilize around 500 million EUROS.
2. Fast track for proposals in order to help business to maintain its R&i initiatives and prioritizing projects related to COVID19 products.
3. Flexible administrative procedures: (1) extension of justification periods by one month for finalizing projects; (2) flexibility in the repayment of partially reimbursable grants; 
4. From March 14, 2020 to June 30, 2020: exemption of payment of interests on principal and/or ordinary for companies benefiting from partially reimbursable grants, when the payment is made within a maximum period of 4 months from it is due. This measure will only be applicable to companies that have a valid loan contract with CDTI.
5. Expansion of the “Direct Expansion Line (LIC-A)” currently limited to Andalusia, Canary Islands, Castilla y León, Castilla-La Mancha, Comunidad Valenciana (excluding the city of Valencia), Extremadura, Galicia and Region of Murcia, to the entire national territory
6. Flexibility of criteria for accessing to “Innvierte Coinversión” (until June 30, 2020) to especially support SMEs and facilitate access to capital through CDTI co-investment mechanism. CDTI will accelerate time to funding -the minimum time from investors’ analysis to approval-. Innvierte's initial minimum investment requirement is reduced to 250,000 EUROS, jointly considering all investors are leveraged. For actions aimed at technological developments related to COVID19, Innvierte investments may be below 250,000 EUROS to accelerate innovative projects uptake.

Relevant information at:
http://www.ciencia.gob.es/portal/site/MICINN/menuitem.edc7f2029a2be27d7010721001432ea0/?vgnextoid=7e59f67b7a8e0710VgnVCM1000001d04140aRCRD&vgnextchannel=4346846085f90210VgnVCM1000001034e20aRCRD 

https://www.lamoncloa.gob.es/serviciosdeprensa/notasprensa/ciencia-e-innovacion/Paginas/2020/200320-covid-investigacio.aspx  

http://www.ciencia.gob.es/portal/site/MICINN/menuitem.edc7f2029a2be27d7010721001432ea0/?vgnextoid=7e59f67b7a8e0710VgnVCM1000001d04140aRCRD&vgnextchannel=4346846085f90210VgnVCM1000001034e20aRCRD"
Sweden|2020-03-28|"Call for research funding is open. 
Medical universities and the research infrastructure for Life sciences, SciLifeLab, will together with private funds perform tests for Covid-19 in order to increase the national testing capacity. Commercial test-kits will be assessed for accuracy by testing them together with testing in the Health care sector. 
More actions are being planned."
